{
  "schemaVersion": "1.0",
  "id": "bench-09-pilot",
  "version": "v1",
  "kind": "generic",
  "taskFiles": ["tasks/rename-local.json", "tasks/fix-boundary.json", "tasks/cross-file-config.json", "tasks/api-contract.json", "tasks/preserve-refactor.json", "tasks/docs-sync.json", "tasks/scope-guard.json", "tasks/dag-order.json", "tasks/recovery-cleanup.json", "tasks/negative-blocked.json"],
  "arms": [
    {"id": "direct", "kind": "direct", "provider": "codex", "model": "gpt-5.6-luna", "effort": "medium"},
    {"id": "orchestrated-no-icm", "kind": "orchestrated-no-icm", "provider": "codex", "model": "gpt-5.6-luna", "effort": "medium"},
    {"id": "full-icm", "kind": "full-icm", "provider": "codex", "model": "gpt-5.6-luna", "effort": "medium"}
  ],
  "repetitions": 1,
  "metrics": ["verified-task-success", "first-pass-success", "scope-safety", "human-active-minutes", "latency", "tokens", "cost-usd"],
  "thresholds": {"verified-task-success": 0.0, "valid-observations": 0.9},
  "budgets": {"maximumInvocations": 30, "maximumMinutes": 180, "maximumCostUsd": null},
  "oracleAccess": "evaluator-only",
  "labels": {"purpose": "bounded-directional-pilot", "provider": "codex", "model": "gpt-5.6-luna", "effort": "medium", "authority": "non-authoritative"}
}
